{"$defs":{"artifact":{"additionalProperties":false,"properties":{"path":{"type":"string"},"sha256":{"pattern":"^[0-9a-f]{64}$","type":"string"}},"required":["path","sha256"],"type":"object"}},"$id":"https://leanctx.dev/contracts/delivery-manifest-v1.schema.json","$schema":"https://json-schema.org/draft/2020-12/schema","additionalProperties":false,"properties":{"component":{"additionalProperties":false,"properties":{"name":{"type":"string"},"version":{"type":"string"}},"required":["name","version"],"type":"object"},"configuration":{"additionalProperties":false,"properties":{"migration":{"type":"string"},"schema_version":{"type":"string"}},"required":["schema_version","migration"],"type":"object"},"contracts":{"additionalProperties":false,"properties":{"pack_digest":{"pattern":"^sha256:[0-9a-f]{64}$","type":"string"},"pack_version":{"type":"string"}},"required":["pack_version","pack_digest"],"type":"object"},"evidence":{"additionalProperties":false,"properties":{"provenance":{"$ref":"#/$defs/artifact"},"sbom":{"$ref":"#/$defs/artifact"},"signature":{"$ref":"#/$defs/artifact"},"vulnerability_report":{"$ref":"#/$defs/artifact"}},"required":["sbom","provenance","signature","vulnerability_report"],"type":"object"},"image":{"additionalProperties":false,"properties":{"digest":{"pattern":"^sha256:[0-9a-f]{64}$","type":"string"},"reference":{"type":"string"}},"required":["reference","digest"],"type":"object"},"schema_version":{"const":"leanctx.delivery/v1"},"source":{"additionalProperties":false,"properties":{"commit":{"pattern":"^[0-9a-f]{40}$","type":"string"},"repository":{"type":"string"}},"required":["repository","commit"],"type":"object"}},"required":["schema_version","component","source","image","configuration","contracts","evidence"],"type":"object"}
