{"component":{"name":"lean-ctx","version":"3.9.11"},"configuration":{"migration":"docs/releases/migration-1.0.md","schema_version":"1"},"contracts":{"pack_digest":"sha256:eae936838f788b29fe82c80ebeedeb843edb1b71121e664c39e272730f638453","pack_version":"3.0.0"},"evidence":{"provenance":{"path":"tests/delivery/valid/provenance.slsa.json","sha256":"ecb751e4c5883eaaa7fb0f3e318c01cbf1df54870d3149199650addd4ddb4c6a"},"sbom":{"path":"tests/delivery/valid/sbom.cdx.json","sha256":"feb33f30087a3f75f6fff95b013769a5886141d73aed077a842dcf1aa945dc8c"},"signature":{"path":"tests/delivery/valid/signature.bundle.json","sha256":"a0da8496e1d614b4ddbe7b6c002b8ed2526082806615b7ca9ccb7c2da60e198b"},"vulnerability_report":{"path":"tests/delivery/valid/vulnerability-report.json","sha256":"101212bef7d44062b7bac0c7bb30911200913c344ee21ea5f9e9e907355161a1"}},"image":{"digest":"sha256:66a473ef83fdd7052dd00b0fdde3a8d8a17b7c898f857a91db25aa7ae625165c","reference":"ghcr.io/yvgude/lean-ctx"},"schema_version":"leanctx.delivery/v1","source":{"commit":"39214d08cbf519210a86533da7efe4487b9520f6","repository":"https://github.com/yvgude/lean-ctx"}}
